{"dataset_class":"DERIVED","extraction_attempt_id":"policy-extract:bbbbbbbbbbbbbbbbbbbbbbbbbbbbbbbb","receipt_id":"notice-receipt:bbbbbbbbbbbbbbbbbbbbbbbbbbbbbbbb","notice_id":"SIN-PREPAYMENT-FEE-V2","attempted_at":"2026-09-25T00:10:00Z","parser_version":"synthetic-notice-json-v1","status":"SUCCEEDED"}
