{"dataset_class":"DERIVED","extraction_attempt_id":"policy-extract:aaaaaaaaaaaaaaaaaaaaaaaaaaaaaaaa","receipt_id":"notice-receipt:aaaaaaaaaaaaaaaaaaaaaaaaaaaaaaaa","notice_id":"SIN-PREPAYMENT-FEE-V1","attempted_at":"2026-09-11T00:10:00Z","parser_version":"synthetic-notice-json-v1","status":"SUCCEEDED"}
