{"dataset_class":"DERIVED","extraction_attempt_id":"policy-extract:22222222222222222222222222222222","receipt_id":"notice-receipt:22222222222222222222222222222222","notice_id":"SIN-SELLER-CHECKLIST-V2","attempted_at":"2026-09-25T01:30:00Z","parser_version":"synthetic-notice-json-v1","status":"SUCCEEDED"}
